"PMID","Year","Title","Abstract","FirstAuthor"
"42047422","2026","Artificial Intelligence and Biological Age: How Many Years Young Are You?","N/A","Kadiyala"
"42029372","2026","Left Bundle Branch Area Pacing: Does Lead Position Matter?","N/A","Burri"
"41995655","2026","His Bundle Pacing for Cardiac Resynchronization Therapy: Physiological Elegance Meets Clinical Reality.","N/A","Cano"
"41973899","2026","His Pacing vs Biventricular Pacing for Cardiac Resynchronization Therapy: Long-Term Follow-Up From the His-Alternative I Trial.","The His-Alternative I (A Randomized Trial of His Pacing Versus Biventricular Pacing in Symptomatic Heart Failure Patients With Left Bundle Branch Block) trial was the first randomized European trial to compare cardiac resynchronization therapy (CRT) delivered by His bundle pacing (His-CRT) vs CRT delivered by conventional biventricular pacing (BiV-CRT). The goal of this study was to compare long-term lead performance, survival, and echocardiographic response between His-CRT and BiV-CRT. A total of 50 patients with symptomatic heart failure (HF), left ventricular ejection fraction ≤35%, and left bundle branch block were randomized 1:1 to undergo His-CRT or BiV-CRT. Following crossover at implantation, 19 patients received His-CRT and 31 received BiV-CRT. The primary analyses were conducted by these groups, with 5 years of follow-up. Outcomes included the occurrence of reinterventions, an endpoint of all-cause mortality or hospitalization for HF, and echocardiographic response (≥15% reduction in left ventricular end-systolic volume compared with baseline). The median follow-up was 5.3 years (Q1-Q3: 4.6-5.7 years). More lead revisions (37% vs 3%; P = 0.003) and generator replacements (47% vs 10%; P = 0.005) occurred in the His-CRT group compared with the BiV-CRT group. However, no statistically significant differences in reinterventions and threshold development over time were observed between the His-CRT patients with implantation thresholds ≤2.5 V/1 millisecond and the BiV-CRT group. The risk of all-cause mortality or hospitalization for HF was similar between groups (HR: 0.32; 95% CI: 0.07-1.49; P = 0.147), and echocardiographic response was comparable between the 2 groups (89% in His-CRT and 90% in BiV-CRT; P = 1.0). No statistically significant difference in long-term performance was detected between His-CRT with low implantation thresholds and BiV-CRT, and echocardiographic response was comparable.","Frandsen"
"41954553","2026","LBBAP Is Not LBBP.","N/A","Joza"
"41860505","2026","Long-Term Outcomes and Safety of His-Purkinje Conduction System Pacing in China: The ChiCSP Study.","Conduction system pacing (CSP), including His bundle pacing (HBP) and left bundle branch area pacing (LBBAP), offers a physiological alternative to conventional pacing. However, current evidence is limited by small sample sizes, short follow-up, and inconsistent LBBAP definitions. This study evaluated the long-term outcomes, safety, and lead performance of CSP in a large multicenter cohort, and provided a precise LBBAP classification for investigating its impact on clinical outcomes. This prospective registry-based study included patients receiving CSP at 5 Chinese centers from 2019 to 2021. LBBAP was classified as left bundle branch pacing (LBBP), left ventricular septal pacing (LVSP), or unclassified LBBAP based on the presence, absence, or uncertainty of left bundle branch capture. Pacing and clinical outcomes were analyzed. Of 3,336 enrolled patients, 3,167 successfully received CSP (557 HBP, 2,610 LBBAP), with a mean follow-up of 41.3 ± 14.0 months. LBBAP comprised LBBP (84.2%), unclassified (12.5%), and LVSP (3.3%). In patients with LBBB and heart failure with reduced ejection fraction, LBBP and HBP achieved the greatest LVEF improvements (+20.7% and +21.9%), while LVSP showed the least (+12.1%). LVSP was associated with higher mortality or heart failure hospitalization (33.3%) compared with LBBP (8.6%) and unclassified LBBAP (15.4%). Threshold increases ≥1 V/0.5 ms occurred in 5.03% HBP vs 1.80% LBBAP (P < 0.001). Procedural complications (excluding threshold rise) occurred in 1.3% of both groups. CSP demonstrated long-term safety and stability. Subclassification of LBBAP enhances clinical precision, with LBBP capture yielding a higher positive clinical outcomes and LVSP with inferior outcomes, especially in cardiac resynchronization therapy patients.","Huang"
"41817497","2026","Left Bundle Branch Area Antitachycardia Pacing Improves Success Rate Compared to Right Ventricular Antitachycardia Pacing.","Antitachycardia pacing (ATP) therapy applies a sequence of pacing pulses to terminate ventricular tachycardia (VT). Clinically, left bundle branch area (LBBA) pacing has emerged as a novel way to induce synchronous ventricular activation. The main aim of this study was to compare the efficacy and safety of ATP delivered to an LBBA lead and a conventional right ventricular (RV) lead. Using a preclinical animal model (n = 7), pacing leads were implanted in the RV apex and LBBA and connected to implantable cardioverter-defibrillators. The left anterior descending artery was occluded for 2 hours to cause an ischemia-reperfusion injury. Four days following ischemia-reperfusion injury, VT episodes were induced using programmed pacing, and burst ATP therapy was delivered to the RV/LBBA leads for each VT episode. Activation sequences from an implanted basket catheter were determined for the pretherapy VT and ATP beats. VT was induced 80 times, with a mean VT cycle length of 180.0 ± 30.0 milliseconds. ATP delivered to the LBBA terminated VT more often than RV ATP (70.2% vs 47.3%; P = 0.040). There was no significant difference in VT acceleration or ventricular fibrillation induction. The number of ATP pulses required for the activation sequences to correlate with the captured ATP pattern rather than the pretherapy VT pattern was lower for LBBA compared to RV ATP (4.1 vs 5.1 pulses; P = 0.047). Improved performance of LBBA compared to RV ATP provides an incentive for future clinical studies in patients who are at risk of sudden cardiac death.","Offei"
"41790087","2026","Electrocardiogram-Based Artificial Intelligence to Predict Recurrence After Cardioversion for Newly Diagnosed Atrial Fibrillation.","N/A","Usuda"
"41790086","2026","Exploring Mechanical Synchrony and Myocardial Work Across Different Pacing Locations Within the Left Bundle Branch.","Left bundle branch pacing (LBBP) enables physiological activation by capturing the left conduction system at various sites. However, whether mechanical synchrony and efficiency vary depending on the pacing location remains unclear. The study aim was to evaluate whether left ventricular (LV) mechanical performance varies among different LBBP sites and whether paced mechanical synchrony replicates intrinsic LV activation across locations. This prospective cohort study included 114 patients with preserved LV ejection fraction who received LBBP for bradycardia indications. At follow-up, echocardiographic analysis included strain-derived and myocardial work parameters. In patients with intrinsic rhythm, within-patient comparisons between intrinsic and paced beats were performed. Central LBB capture (left bundle trunk or septal fascicle pacing) was achieved in 60 patients of 106 patients (56.6%) and peripheral LBB capture (left posterior or left anterior fascicle pacing) in 46 of 106 patients (43.4%). No significant differences in global longitudinal strain or myocardial work indices (global work index, global constructive work, global wasted work, or global work efficiency) were found between central and peripheral LBB captures. Compared with intrinsic rhythm, LBBP did not lead to significant differences in global work efficiency, global work index, global constructive work, or global wasted work, and the echocardiographic changes from intrinsic to paced rhythm were similar between study groups. In patients with preserved LV ejection fraction, mechanical synchrony and work efficiency were similar across LBB pacing sites. These findings support a pragmatic approach centered on achieving conduction system capture rather than targeting specific anatomical locations.","Tapia Martínez"
"41498721","2025","From Algorithm to Bedside: Making AI Models Clinically Meaningful.","N/A","Holmström"
"41441802","2025","Preimplantation AI-ECG Age as a Predictor of Survival Following Cardiac Resynchronization Therapy.","About one-third of patients with heart failure with reduced ejection fraction remain nonresponders to guideline-directed cardiac resynchronization therapy. An algorithm for age prediction using an artificial intelligence-enabled electrocardiography (AI-ECG) has been proposed as a marker of a patient's ""biological"" age. This study aimed to evaluate the utility of the preimplantation AI-ECG age in predicting survival post cardiac resynchronization therapy with defibrillator (CRT-D). We retrospectively reviewed records of patients who underwent CRT-D at the Mayo Clinic between January 1, 2001 and September 30, 2022. All patients with left ventricular ejection fraction ≤35%, QRS duration ≥120 milliseconds, and CRT-D were included. The primary endpoint was all-cause mortality. From preimplantation ECGs, chronological age and AI-ECG age were obtained using the Mayo Clinic AI-ECG age algorithm. The δage was calculated as the patient's AI-ECG age minus the chronological age. Survival analyses were conducted. A total of 464 patients were included. Patients with δage < 0 were chronologically older with a greater incidence of hypertension, coronary artery disease, hyperlipidemia, and peripheral vascular disease (P < 0.05). In multivariable analyses, with δage as a continuous variable, a lower δage correlated with longer survival post implantation (time ratio: 0.96; P = 0.007). Other markers of prolonged survival included a lower chronological age, nonischemic cardiomyopathy, absence of advanced chronic kidney disease, and hypertension. As a categorical variable, δage >5.1 years portended shorter survival than a δage between -5.1 and 5.1 years (time ratio: 0.62; P = 0.017). Preimplantation AI-ECG-derived δage is an independent predictor of survival post-CRT-D. The lower the AI-ECG age compared to the chronological age, the longer the post-CRT-D survival, possibly reflective of a lower ""biologic"" age.","Gupta"
"41416973","2025","Dynamic Conduction Variability: Beat-to-Beat Changes in His Bundle and Right Bundle Activation and QRS Morphology.","N/A","Miyazaki"
"41348081","2025","Predicting Sudden Cardiac Death in Patients With Sarcoidosis Using a Multimodal Artificial Intelligence Model.","Patients with cardiac sarcoidosis (CS) are at high risk of sudden cardiac death (SCD), but existing guidelines relying primarily on left ventricular ejection fraction (LVEF) in recommending implantable cardioverter-defibrillator therapy have limited accuracy. This study sought to develop and evaluate a multimodal artificial intelligence for ventricular risk stratification in CS (MAARS-CS), integrating raw late gadolinium enhancement cardiac magnetic resonance (LGE-CMR) images and clinical covariates to predict SCD risk in patients with sarcoidosis. A retrospective cohort of 317 patients with sarcoidosis was used to train and test MAARS-CS using 5-fold cross-validation. The model comprised a CMR branch using a 3-dimensional convolutional neural network for LGE-CMR image analysis, an electronic health records branch using a feedforward neural network for clinical covariates, and a classifier integrating multimodal information to predict personalized SCD risk. MAARS-CS achieved an area under the receiver-operating characteristic curve (AUROC) of 0.86 (95% CI: 0.80-0.91), significantly outperforming the LVEF ≤35% criterion (AUROC: 0.59; 95% CI: 0.53-0.66; P < 0.0001 compared with MAARS-CS) and continuous LVEF (AUROC: 0.77; 95% CI: 0.67-0.85; P = 0.019 compared with MAARS-CS). The model also showed higher area under the precision-recall curve (0.54 vs 0.43) and balanced accuracy (0.83 vs 0.74) compared with continuous LVEF. MAARS-CS maintained robust performance across varying image qualities and magnetic resonance sequences. Interpretation analysis identified key clinical covariates and important image regions contributing to SCD risk predictions. MAARS-CS offers superior predictive accuracy and consistency over LVEF in predicting SCD risk among patients with sarcoidosis. The model's robustness and interpretability enhance its potential as a reliable clinical decision support tool. With further validation, MAARS-CS may improve personalized patient care in sarcoidosis.","Lai"
"41288542","2025","Conduction System Pacing for Cardiac Sarcoidosis: A Mission Impossible for LBBAP?","N/A","Bressi"
"41288540","2025","Detection of Titin-Associated Electrocardiography Features in Dilated Cardiomyopathy Using Conventional and Deep Neural Network Analysis.","Titin truncating variants (TTNtvs) are the leading genetic cause of dilated cardiomyopathy (DCM). Although recommended, routine genetic testing is frequently not performed owing to resource constraints. This study sought to identify electrocardiography (ECG) parameters predictive of an underlying TTNtv in DCM patients, comparing conventional ECG analysis with an ECG-based deep neural network (DNN) to identify patients that would benefit most from targeted genetic testing. This retrospective multinational study compared baseline ECGs from 99 DCM patients with (likely) pathogenic TTNtv with 318 gene-elusive DCM patients. Conventional ECG parameters (eg, QRS duration) were extracted. The DNN was trained to compress ECGs into 21 explainable factors, summarizing relevant ECG features. Discriminative performances of both created models, built using LASSO regularization for variable selection to fit logistic regression model, were compared (eg, C-statistics). TTNtv patients were younger (50.5 vs 56.9 years; P < 0.001), predominantly male (69.7 vs 54.7%; P = 0.008), and had lower left ventricular ejection fraction (28.0% vs 35.0%; P < 0.001) compared with gene-elusive patients. Conventional ECG analysis identified shorter QRS duration (P < 0.001), prolonged PR interval (P < 0.001), and a trend toward reduced QRS voltage (P = 0.098) as TTNtv characteristics. In the DNN model, factors F1 (inferolateral T wave inversion) and F9 (anterior T-wave inversion), among others, were associated with TTNtv. The conventional and DNN models showed good predictive performance for TTNtv (C-statistics: conventional 0.83, DNN 0.86; P = 0.197). Conventional ECG and DNN analyses demonstrated similar good predictive performance in distinguishing TTNtv from gene-elusive DCM patients, emphasizing their potential as clinical tools to guide targeted genetic testing.","Heymans"
"41263722","2025","Left Bundle Branch Area Pacing in Patients With Cardiac Sarcoidosis.","Left bundle branch area pacing (LBBAP) offers a physiological alternative to traditional pacing and has shown benefit across cardiomyopathy phenotypes. In cardiac sarcoidosis (CS), in which septal inflammation and scarring are common, the performance and clinical impact of LBBAP remain unclear. The aim of this study was to evaluate procedural success, lead performance, and outcomes of LBBAP in patients with CS. This study retrospectively identified patients with CS who underwent LBBAP from January 2020 to March 2024 at a single tertiary center. CS was defined per Heart Rhythm Society criteria using histologic or imaging-based evidence. Procedural metrics, device parameters, and echocardiographic data were assessed at baseline and follow-up. LBBAP was confirmed by using European Heart Rhythm Association criteria. Nineteen patients met inclusion criteria (mean age 59 ± 12 years; 21% female). Atrioventricular block was the most common indication (58%). Septal involvement was seen in 53% (cardiac magnetic resonance imaging) and 61% (positron emission tomography). LBBAP was successful in all patients without acute complications. Baseline paced QRS duration was 139 ± 25 milliseconds; mean threshold was 0.75 ± 0.26 V, R-wave amplitude 15.2 ± 6.3 mV, and impedance 738 ± 208 Ω. Over a 437-day median follow-up, lead parameters remained stable. Among patients with LBBB, QRS >130 milliseconds, and left ventricular ejection fraction (LVEF) <50% (n = 4), LVEF improved from 27% ± 17% to 50% ± 12% (P = 0.06). No differences in pacing parameters were seen based on septal involvement. LBBAP in CS is feasible and provided stable long-term lead performance in this cohort. Larger studies are needed to assess its clinical benefit in the presence of septal inflammation and fibrosis.","Gurin"
"41134245","2025","QT Interval Correction in Left Bundle Branch Area Pacing.","N/A","Pillai"
"41134241","2025","Risk Stratification in Left Bundle Branch Block After Transcatheter Aortic Valve Implantation: A Multicenter ECG Algorithm Study.","Managing left bundle branch block (LBBB) after transcatheter aortic valve implantation (TAVI) remains challenging. The aim of this study was to develop a novel, simplified electrocardiogram (ECG) algorithm for predicting infranodal conduction delay in LBBB (both new onset as well as preexisting) patients after TAVI and to compare its performance vs current European Society of Cardiology (ESC) ECG criteria. A multicenter analysis of prospectively enrolled patients undergoing electrophysiology testing for preexisting or new-onset LBBB after TAVI was conducted. The novel algorithm was developed by analyzing various combinations of the PR interval, QRS duration pre-TAVI and post-TAVI, and changes in these parameters to identify patients with infranodal conduction delay (defined as a His-ventricular interval ≥70 milliseconds). A total of 769 patients with LBBB (12% preexisting) after TAVI underwent risk stratification using electrophysiology testing at 7 institutions (mean age 81 ± 7 years; 57% female; 21% His-ventricular ≥70 milliseconds). A novel algorithm using solely a PR interval of 190 milliseconds and a QRS interval of 160 milliseconds revealed a sensitivity of 88% and an negative predictive value of 92% for the rule-out of infranodal conduction delay (PR interval post-TAVI <190 milliseconds AND QRS duration post-TAVI <160 milliseconds) and a specificity and positive predictive value of 85% and 41%, respectively, for the rule-in of infranodal conduction delay (PR interval post-TAVI ≥190 milliseconds AND QRS duration post-TAVI ≥160 milliseconds). By comparison, the ESC ECG criteria showed a sensitivity of 72%, a negative predictive value of 88%, specificity of 53%, and a positive predictive value of 28%. The novel, simplified ECG algorithm showed a superior performance for the rule-out and rule-in of infranodal conduction delay compared with current ESC ECG criteria.","Badertscher"
"40938228","2025","Infant Electrocardiogram-Based Deep Learning Predicts Critical Congenital Heart Disease.","N/A","Mayourian"
"40866024","2025","Reply: Septal Perforation During Left Bundle Branch Pacing: Into the Abyss of the Unknown.","N/A","Kato"
"40866023","2025","Septal Perforation During Left Bundle Branch Pacing: Into the Abyss of the Unknown.","N/A","Ponnusamy"
"40838921","2025","Rethinking Risk in Mitral Valve Prolapse: The Promise of Machine Learning and Multimodal Phenotyping.","N/A","Deharo"
"40772890","2025","Seeing the Forest for the Trees: A Novel Marker for the His-Purkinje System.","N/A","Hanna"
"40767798","2025","Fully Automated Anatomy Labeling for Intracardiac Echocardiography Using Deep Learning.","Intracardiac echocardiography (ICE) is increasingly being used to guide electrophysiologic (EP) procedures but requires a considerable learning curve. ICE images collected from 2 separate institutions (605 EP procedures, 196,768 images) were used to develop an automated deep learning-based algorithm to detect anatomic structures from the right atrium. Fifteen of 21 anatomic structures were correctly identified with >70% precision and recall. Mislabeling of one anatomic structure for another was rare. This fully automated anatomy labeling algorithm can serve as an education tool or can be used as a navigation tool to guide ICE operators in EP procedures.","Gol Gungor"
"40738599","2025","Reply: QS Morphology in a Nonfiltered Unipolar Electrogram From a Left Bundle Branch Pacing Lead.","N/A","Kato"
"40738598","2025","QS Morphology in a Nonfiltered Unipolar Electrogram From a Left Bundle Branch Pacing Lead.","N/A","Iida"
"40569238","2025","New ECG Morphologic Criteria for the Identification of Left Bundle Branch Capture.","Identification of left bundle branch capture (LBBc) during left bundle branch area pacing remains challenging. This study sought to validate the utility of new simple morphologic criteria for the identification of LBBc. Patients with proven LBBc based on the presence of QRS transition during decremental output pacing were included. The paced VQRS upstroke/downstroke was quantitatively and qualitatively evaluated, and classified as fast or slow, with fast upstroke patterns associated with LBBc and slow upstroke patterns with left ventricular septal capture (LVSc). Additionally, the appearance of a paced QRS downstroke slurring/notching in any lead not previously present during lead penetration and/or an M QRS pattern in inferior leads was also considered suggestive of LBBc. Accuracy of these criteria was tested by independent evaluators using exclusively qualitative electrocardiogram morphologic features. 115 patients with proven LBBc were included. Mean VQRS upstroke duration during LBBc was significantly shorter than during LVSc (34.6 +/- 10.1 ms vs 63.2 +/- 12.1 ms; P < 0.001). A paced Vupstroke/downstroke ratio <1 had a sensitivity and specificity of 0.97 and 0.95 for the identification of LBBc. A slurred/notched QRS downstroke or M pattern in inferior leads was present in 91.1% during LBBc in baseline narrow QRS patients with inferior paced QRS axis, with sensitivity and specificity being 0.91 and 0.87, respectively. Using exclusively qualitative criteria, independent evaluators were able to identify the correct capture pattern in 87% of LBBc and 89% of LVSc cases, with diagnostic accuracy being significantly lower among dilated cardiomyopathy patients: 70.4% vs 93%; P = 0.004. Simple electrocardiogram morphologic criteria can accurately identify LBBc during left bundle branch area pacing in patients with baseline narrow QRS and/or without cardiomyopathy.","Cano"
"40569236","2025","Left Ventricular Mechanics During Left Ventricular Septal Pacing are Similar to Those During Left Bundle Branch Pacing.","N/A","Prinzen"
"40569235","2025","Demystifying the Electrocardiogram of Left Bundle Branch Area Pacing.","N/A","Burri"
"40504057","2025","Conduction System Pacing for Resynchronization Therapy: CONSYSTent and Beyond.","N/A","Chelu"
"40471767","2025","Detecting Arrhythmogenic Right Ventricular Cardiomyopathy From the Electrocardiogram Using Deep Learning.","N/A","Sigfstead"
"40439650","2025","Left Ventricular Mechanical Insights Into Left Bundle Branch Pacing and Left Ventricular Septal Pacing.","The relationship between left ventricular (LV) mechanical efficiency and various modalities of left bundle branch area pacing (LBBAP) is not well understood. The goal of this study was to evaluate the correlation between 2 different modalities of LBBAP, including left bundle branch pacing (LBBP) and LV septal pacing (LVSP) and myocardial work (MW), during spontaneous rhythm and LBBAP in patients with normal or moderately reduced LV ejection fraction. Patients were retrieved from the TREEBEARD prospective study and categorized into 2 groups based on whether they received LBBP or LVSP. MW was assessed using metrics such as global work index, global constructive work, global wasted work, and global work efficiency. Overall, 155 patients were included in the study (mean age 73.3 +/- 14.3 years; 74.8% male), with 102 in the LBBP group and 53 in the LVSP group. In the LBBP group, all MW indices displayed a strong correlation between values recorded during spontaneous rhythm and LBBP. Conversely, the LVSP group exhibited moderate correlations for global work index (r = 0.535; P = 0.004), global constructive work (r = 0.587; P = 0.009), and global work efficiency (r = 0.503; P = 0.01). Global wasted work did not show a statistically significant correlation (r = 0.641; P = 0.13). In patients with preserved or moderately reduced LV ejection fraction, LBBP exhibited LV mechanical efficiency comparable to that of spontaneous LV activation. Conversely, LVSP is a valuable option, but LV mechanics is impaired, showing a reduced GWE of the left ventricle.","Bertini"
