"PMID","Year","Title","Abstract","FirstAuthor"
"39243255","2024","Optimizing the Distribution of Ablation Lesions to Prevent Postablation Atrial Tachycardia: A Personalized Digital-Twin Study.","Although targeting atrial fibrillation (AF) drivers and substrates has been used as an effective adjunctive ablation strategy for patients with persistent AF (PsAF), it can result in iatrogenic scar-related atrial tachycardia (iAT) requiring additional ablation. Personalized atrial digital twins (DTs) have been used preprocedurally to devise ablation targeting that eliminate the fibrotic substrate arrhythmogenic propensity and could potentially be used to predict and prevent postablation iAT. In this study, the authors sought to explore possible alternative configurations of ablation lesions that could prevent iAT occurrence with the use of biatrial DTs of prospectively enrolled PsAF patients. Biatrial DTs were generated from late gadolinium enhancement-magnetic resonance images of 37 consecutive PsAF patients, and the fibrotic substrate locations in the DT capable of sustaining reentries were determined. These locations were ablated in DTs by representing a single compound region of ablation with normal power (SSA), and postablation iAT occurrence was determined. At locations of iAT, ablation at the same DT target was repeated, but applying multiple lesions of reduced-strength (MRA) instead of SSA. Eighty-three locations in the fibrotic substrates of 28 personalized biatrial DTs were capable of sustaining reentries and were thus targeted for SSA ablation. Of these ablations, 45 resulted in iAT. Repeating the ablation at these targets with MRA instead of SSA resulted in the prevention of iAT occurrence at 15 locations (18% reduction in the rate of iAT occurrence). Personalized atrial DTs enable preprocedure prediction of iAT occurrence after ablation in the fibrotic substrate. It also suggests MRA could be a potential strategy for preventing postablation AT.","Sakata"
"39177552","2024","Left Bundle Branch Area Pacing for LBBB: Will Left Ventricular Septal Pacing Do?","N/A","Friedman"
"38970598","2024","Left Bundle Branch Area Pacing With or Without Conduction System Capture in Heart Failure Models.","Left bundle branch area pacing includes left bundle branch pacing (LBBP) and left ventricular septal pacing (LVSP), which is effective in patients with dyssynchronous heart failure (DHF). However, the basic mechanisms are unknown. This study aimed to compare LBBP with LVSP and explore potential mechanisms underlying the better clinical outcomes of LBBP. A total of 24 beagles were assigned to the following groups: 1) control group; 2) DHF group, left bundle branch ablation followed by 6 weeks of AOO pacing at 200 ppm; 3) LBBP group, DHF for 3 weeks followed by 3 weeks of DOO pacing at 200 ppm; and 4) LVSP with the same interventions in the LBBP group. Metrics of electrocardiogram, echocardiography, hemodynamics, and expression of left ventricular proteins were evaluated. Compared with LVSP, LBBP had better peak strain dispersion (44.67 ± 1.75 ms vs 55.50 ± 4.85 ms; P < 0.001) and hemodynamic effect (dP/dtmax improvement: 27.16% ± 7.79% vs 11.37% ± 4.73%; P < 0.001), whereas no significant differences in cardiac function were shown. The altered expressions of proteins in the lateral wall vs septum in the DHF group were partially reversed by LBBP and LVSP, which was associated with the contraction and adhesion process, separately. The animal study demonstrated that LBBP offered better mechanical synchrony and improved hemodynamics than LVSP, which might be explained by the reversed expression of contraction proteins. These results supported the potential superiority of left bundle branch area pacing with the capture of the conduction system in DHF model.","Cheng"
"38934972","2024","Left Bundle Branch Area Pacing for All . . . ?: Yet Again, Structure Dictates Function.","N/A","Daoud"
"38878013","2024","Retrograde Conduction in Left Bundle Branch Block: Insights From Left Bundle Branch Pacing.","Biventricular pacing is a well-established therapy for patients with heart failure (HF), left bundle branch block (LBBB) and left ventricular (LV) dysfunction. Left bundle branch pacing (LBBP) has emerged as an alternative to biventricular pacing. The aim of this study was to assess the retrograde conduction properties of the left bundle branch in patients with nonischemic cardiomyopathy and LBBB during LBBP and its clinical implications. Patients undergoing successful LBBP for nonischemic cardiomyopathy with LV ejection fraction (LVEF) ≤35% and LBBB were included. Continuous recording of His potential was performed using a quadripolar catheter. Unidirectional block was defined as retrograde His bundle activation during LBBP with stimulus to His potential (SH) duration less than or equal to antegrade HV interval and bidirectional block as VH dissociation or SH duration greater than HV interval. HF hospitalization, ventricular arrhythmias, and mortality were documented. A total of 165 patients were included. The mean follow-up duration was 21.8 ± 13.1 months. Bidirectional block (group I) was observed in 82% (n = 136), and these patients were noted to have advanced HF stage and prolonged baseline QRS duration. Unidirectional block (group II) with intact retrograde conduction was observed in 18% (n = 29) and was associated with narrow paced QRS duration and higher LVEF during follow-up. Super-response (LVEF ≥50%) was observed in 54.4% (n = 74) in group I compared with 73.3% (n = 22) in group II (P = 0.03). The OR for LVEF normalization was 4.1 (95% CI: 1.26-13.97; P = 0.02), with unidirectional block compared with bidirectional block in patients with LBBB and LV dysfunction. Adverse clinical outcomes as measured by a composite of HF hospitalization, ventricular arrhythmias, and mortality were significantly higher in group I compared with group II (12.5% vs 0%; P = 0.04). Bidirectional block in LBBB was characterized by advanced HF symptoms, while unidirectional block was associated with better clinical outcomes after cardiac resynchronization therapy by LBBP.","Ponnusamy"
"38842977","2024","Machine Learning of Cardiac Anatomy and the Risk of New-Onset Atrial Fibrillation After TAVR.","New-onset atrial fibrillation (NOAF) occurs in 5% to 15% of patients who undergo transfemoral transcatheter aortic valve replacement (TAVR). Cardiac imaging has been underutilized to predict NOAF following TAVR. The objective of this analysis was to compare and assess standard, manual echocardiographic and cardiac computed tomography (cCT) measurements as well as machine learning-derived cCT measurements of left atrial volume index and epicardial adipose tissue as risk factors for NOAF following TAVR. The study included 1,385 patients undergoing elective, transfemoral TAVR for severe, symptomatic aortic stenosis. Each patient had standard and machine learning-derived measurements of left atrial volume and epicardial adipose tissue from cardiac computed tomography. The outcome of interest was NOAF within 30 days following TAVR. We used a 2-step statistical model including random forest for variable importance ranking, followed by multivariable logistic regression for predictors of highest importance. Model discrimination was assessed by using the C-statistic to compare the performance of the models with and without imaging. Forty-seven (5.0%) of 935 patients without pre-existing atrial fibrillation (AF) experienced NOAF. Patients with pre-existing AF had the largest left atrial volume index at 76.3 ± 28.6 cm/mfollowed by NOAF at 68.1 ± 26.6 cm/mand then no AF at 57.0 ± 21.7 cm/m(P < 0.001). Multivariable regression identified the following risk factors in association with NOAF: left atrial volume index ≥76 cm(OR: 2.538 [95% CI: 1.165-5.531]; P = 0.0191), body mass index <22 kg/m(OR: 4.064 [95% CI: 1.500-11.008]; P = 0.0058), EATv (OR: 1.007 [95% CI: 1.000-1.014]; P = 0.043), aortic annulus area ≥659 mm(OR: 6.621 [95% CI: 1.849-23.708]; P = 0.004), and sinotubular junction diameter ≥35 mm (OR: 3.891 [95% CI: 1.040-14.552]; P = 0.0435). The C-statistic of the model was 0.737, compared with 0.646 in a model that excluded imaging variables. Underlying cardiac structural differences derived from cardiac imaging may be useful in predicting NOAF following transfemoral TAVR, independent of other clinical risk factors.","Brahier"
"38842969","2024","Sex Differences in Left Bundle Branch Area Pacing Versus Biventricular Pacing for Cardiac Resynchronization Therapy.","Women respond more favorably to biventricular pacing (BIVP) than men. Sex differences in atrioventricular and interventricular conduction have been described in BIVP studies. Left bundle branch area pacing (LBBAP) offers advantages due to direct capture of the conduction system. We hypothesized that men could respond better to LBBAP than BIVP. This study aims to describe the sex differences in response to LBBAP vs BIVP as the initial cardiac resynchronization therapy (CRT). In this multicenter prospective registry, we included patients with left ventricular ejection fraction ≤35% and left bundle branch block or a left ventricular ejection fraction ≤40% with an expected right ventricular pacing exceeding 40% undergoing initial CRT with LBBAP or BIVP. The composite primary outcome was heart failure-related hospitalization and all-cause mortality. The primary safety outcome included all procedure-related complications. There was no significant difference in the primary outcome when comparing men and women receiving LBBAP (P = 0.46), whereas the primary outcome was less frequent in women in the BIVP group than men treated with BIVP (P = 0.03). The primary outcome occurred less frequently in men undergoing LBBAP (29.9%) compared to those treated with BIVP (46.5%) (P = 0.004). In women, the incidence of the primary endpoint was 24.14% in the LBBAP group and 36.2% in the BIVP group; however, this difference was not statistically significant (P = 0.23). Complication rates remained consistent across all groups. Men and women undergoing LBBAP for CRT had similar clinical outcomes. Men undergoing LBBAP showed a lower risk of heart failure-related hospitalizations and all-cause mortality compared to men undergoing BIVP, whereas there was no difference between LBBAP and BIVP in women.","Tedrow"
"38829298","2024","LVSP and LBBP Result in Similar or Improved LV Synchrony and Hemodynamics Compared to BVP.","The effect of left ventricular septal myocardial pacing (LVSP) and left bundle branch pacing (LBBP) on ventricular synchrony and left ventricular (LV) hemodynamic status is poorly understood. The aim of this study was to investigate the impact of LVSP and LBBP vs biventricular pacing (BVP) on ventricular electrical synchrony and hemodynamic status in cardiac resynchronization therapy patients. In cardiac resynchronization therapy candidates with LV conduction disease, ventricular synchrony was assessed by measuring QRS duration (QRSd) and using ultra-high-frequency electrocardiography. LV electrical dyssynchrony was assessed as the difference between the first activation in leads Vto Vto the last from leads Vto V. LV hemodynamic status was estimated using invasive systolic blood pressure measurement during multiple transitions between LBBP, LVSP, and BVP. A total of 35 patients with a mean LV ejection fraction of 29% and a mean QRSd of 168 ± 24 ms were included. Thirteen had ischemic cardiomyopathy. QRSd during BVP, LVSP, and LBBP was the same, but LBBP provided shorter LV electrical dyssynchrony than BVP (-10 ms; 95% CI: -16 to -4 ms; P = 0.001); the difference between LVSP and BVP was not significant (-5 ms; 95% CI: -12 to 1 ms; P = 0.10). LBBP was associated with higher systolic blood pressure than BVP (4%; 95% CI: 2%-5%; P < 0.001), whereas LVSP was not (1%; 95% CI: 0%-2%; P = 0.10). Hemodynamic differences during LBBP and LVSP vs BVP were more pronounced in nonischemic than ischemic patients. Ultra-high-frequency electrocardiography allowed the documentation of differences in LV synchrony between LBBP, LVSP, and BVP, which were not observed by measuring QRSd. LVSP provided the same LV synchrony and hemodynamic status as BVP, while LBBP was better than BVP in both.","Curila"
"38597855","2024","Assessing Biological Age: The Potential of ECG Evaluation Using Artificial Intelligence: JACC Family Series.","Biological age may be a more valuable predictor of morbidity and mortality than a person's chronological age. Mathematical models have been used for decades to predict biological age, but recent developments in artificial intelligence (AI) have led to new capabilities in age estimation. Using deep learning methods to train AI models on hundreds of thousands of electrocardiograms (ECGs) to predict age results in a good, but imperfect, age prediction. The error predicting age using ECG, or the difference between AI-ECG-derived age and chronological age (delta age), may be a surrogate measurement of biological age, as the delta age relates to survival, even after adjusting for chronological age and other covariates associated with total and cardiovascular mortality. The relative affordability, noninvasiveness, and ubiquity of ECGs, combined with ease of access and potential to be integrated with smartphone or wearable technology, presents a potential paradigm shift in assessment of biological age.","Lopez-Jimenez"
"38551549","2024","A Single Atrial Extrastimulation Resetting His Bundle During Supraventricular Tachycardia to Differentiate Atrial Tachycardia.","Catheter ablation is the curative treatment for paroxysmal supraventricular tachycardia (SVT). However, atrial tachycardia (AT) diagnosis is often challenging, especially when SVT is terminated by pacing. This study sought to develop a novel method for AT diagnosis. A total of 147 SVTs including 28 ATs, 87 atrioventricular nodal re-entrant tachycardias, and 32 orthodromic reciprocating tachycardias were prospectively studied. Single atrial extrastimulation was performed at the proximal coronary sinus from a coupling interval 20 milliseconds shorter than the tachycardia cycle length and gradually decreased until the His bundle (HB) was first reset and further until the SVT was terminated. The response of the SVT during the first HB resetting and the termination pattern were examined. In 27 of 28 ATs, tachycardia was unaffected when HB resetting whereas, in atrioventricular nodal re-entrant tachycardias or orthodromic reciprocating tachycardias (non-AT), tachycardia was simultaneously reset when HB resetting or was terminated with an atrio-Hisian block. When the coupling interval was further shortened for cases in which tachycardia persisted, all 33 SVTs with tachycardia termination with atrio-Hisian block were non-ATs, whereas 5 ATs and 7 non-ATs were terminated with Hisian-atrial block. The sensitivity, specificity, and positive and negative predictive values of the pattern of tachycardia that was unaffected when HB resetting for AT diagnosis were 96%, 100%, 100%, and 99%, respectively. Those of the pattern of tachycardia termination with atrio-Hisian block for non-AT diagnosis were 92%, 100%, 100%, and 42%, respectively. Single atrial extrastimulation from the proximal coronary sinus during tachycardia was useful and effective for AT diagnosis.","Inaba"
"38363277","2024","Device Electrogram-Guided Determination of Output-Dependent QRS Transition in Left Bundle Branch Pacing.","N/A","Shimeno"
"38340117","2024","Continuous Atrial Fibrillation Monitoring From Photoplethysmography: Comparison Between Supervised Deep Learning and Heuristic Signal Processing.","Continuous monitoring for atrial fibrillation (AF) using photoplethysmography (PPG) from smartwatches or other wearables is challenging due to periods of poor signal quality during motion or suboptimal wearing. As a result, many consumer wearables sample infrequently and only analyze when the user is at rest, which limits the ability to perform continuous monitoring or to quantify AF. This study aimed to compare 2 methods of continuous monitoring for AF in free-living patients: a well-validated signal processing (SP) heuristic and a convolutional deep neural network (DNN) trained on raw signal. We collected 4 weeks of continuous PPG and electrocardiography signals in 204 free-living patients. Both SP and DNN models were developed and validated both on holdout patients and an external validation set. The results show that the SP model demonstrated receiver-operating characteristic area under the curve (AUC) of 0.972 (sensitivity 99.6%, specificity: 94.4%), which was similar to the DNN receiver-operating characteristic AUC of 0.973 (sensitivity 92.2, specificity: 95.5%); however, the DNN classified significantly more data (95% vs 62%), revealing its superior tolerance of tracings prone to motion artifact. Explainability analysis revealed that the DNN automatically suppresses motion artifacts, evaluates irregularity, and learns natural AF interbeat variability. The DNN performed better and analyzed more signal in the external validation cohort using a different population and PPG sensor (AUC, 0.994; 97% analyzed vs AUC, 0.989; 88% analyzed). DNNs perform at least as well as SP models, classify more data, and thus may be better for continuous PPG monitoring.","Antiperovitch"
"38267169","2024","Cardiac Resynchronization Therapy for Non-Left Bundle Branch Block: Time for Change?","N/A","Qin"
"38267165","2024","Sex-Specific Responses to Left Bundle Branch Area Pacing in Heart Failure Patients With Electrical Dyssynchrony.","N/A","Varma"
"38127008","2023","Left Bundle Branch Pacing vs Left Ventricular Septal Pacing vs Biventricular Pacing for Cardiac Resynchronization Therapy.","Left bundle branch pacing (LBBP) and left ventricular septal pacing (LVSP) are considered to be acceptable as LBBAP strategies. Differences in clinical outcomes between LBBP and LVSP are yet to be determined. The purpose of this study was to compare the outcomes of LBBP vs LVSP vs BIVP for CRT. In this prospective multicenter observational study, LBBP was compared with LVSP and BIVP in patients undergoing CRT. The primary composite outcome was freedom from heart failure (HF)-related hospitalization and all-cause mortality. Secondary outcomes included individual components of the primary outcome, postprocedural NYHA functional class, and electrocardiographic and echocardiographic parameters. A total of 415 patients were included (LBBP: n = 141; LVSP: n = 31; BIVP: n = 243), with a median follow-up of 399 days (Q1-Q3: 249.5-554.8 days). Freedom from the primary composite outcomes was 76.6% in the LBBP group and 48.4% in the LVSP group (HR: 1.37; 95% CI: 1.143-1.649; P = 0.001), driven by a 31.4% absolute increase in freedom from HF-related hospitalizations (83% vs 51.6%; HR: 3.55; 95% CI: 1.856-6.791; P < 0.001) without differences in all-cause mortality. LBBP was also associated with a higher freedom from the primary composite outcome compared with BIVP (HR: 1.43; 95% CI: 1.175-1.730; P < 0.001), with no difference between LVSP and BIVP. In patients undergoing CRT, LBBP was associated with improved outcomes compared with LVSP and BIVP, while outcomes between BIVP and LVSP are similar.","Diaz"
"38069976","2023","Toward Digital Twin Technology for Precision Pharmacology.","The authors demonstrate the feasibility of technological innovation for personalized medicine in the context of drug-induced arrhythmia. The authors use atomistic-scale structural models to predict rates of drug interaction with ion channels and make predictions of their effects in digital twins of induced pluripotent stem cell-derived cardiac myocytes. The authors construct a simplified multilayer, 1-dimensional ring model with sufficient path length to enable the prediction of arrhythmogenic dispersion of repolarization. Finally, the authors validate the computational pipeline prediction of drug effects with data and quantify drug-induced propensity to repolarization abnormalities in cardiac tissue. The technology is high throughput, computationally efficient, and low cost toward personalized pharmacologic prediction.","Yang"
"37943191","2023","Outcomes of Upgrading to LBBP in CRT Nonresponders: A Prospective, Multicenter, Nonrandomized, Case-Control Study.","Cardiac resynchronization therapy (CRT) nonresponders account for nearly 30% of CRT candidates. Left-bundle branch pacing (LBBP) is an alternative to CRT. This study aimed to evaluate the feasibility, clinical efficacy, and outcomes of upgrading to LBBP in CRT nonresponders, using propensity-score matching (PSM) analysis. CRT nonresponders were defined as those with an implantable CRT-pacemaker or CRT-defibrillator for more than 12 months who remained nonresponsive (a decrease in left ventricular end-systolic volume of <15% or a left ventricular ejection fraction [LVEF] absolute increase of <5%) after optimal medical therapy and device optimization compared with baseline. In total, 145 CRT nonresponders were prospectively enrolled and randomly divided into 2 groups: upgraded to LBBP (n = 48), and continuing biventricular pacing (BVP) (control; n = 97). PSM was performed at a 1:1 ratio, and clinical evaluation and echocardiographic assessments were compared at baseline and follow-up in paired cohorts. The primary composite endpoint for clinical outcomes (heart failure-related rehospitalization events, all-cause death, or heart transplantation) was analyzed. Successful upgrading to LBBP was achieved in 48/49 patients (97.96%), with a significant decrease in QRS duration (P < 0.001). In the paired LBBP group, LVEF significantly increased (baseline: 29.75% ± 7.79%; 6 months: 37.78% ± 9.25% [P < 0.001]; 12 months: 38.84% ± 12.13% [P < 0.001]) with 21/44 patients (47.73%) classified as echocardiographically responsive, whereas in the BVP control group, no significant improvement was observed (29.55% ± 6.74% vs 29.22% ± 8.10%; P = 0.840). In a multivariate logistic regression model, LV end-diastolic volume and baseline LBBB QRS morphology were independent predictors of echocardiographic response after upgrading to LBBP. At a median 24 months, the primary composite endpoint was significantly lower in the LBBP group (HR: 0.31; 95% CI: 0.14-0.72; log-rank P = 0.007). Upgrading to LBBP is feasible and effective in achieving significant heart function improvement and better clinical outcomes in CRT nonresponders, making it a reasonable and promising pacing strategy. (LBBP in CRT Non-Response patients; ChiCTR1900028131).","Chen"
"37758375","2023","Reply: Is Left Bundle Branch Area Pacing the Optimal Strategy for Cardiac Resynchronization Therapy?","N/A","Diaz"
"37758374","2023","Is Left Bundle Branch Area Pacing the Optimal Strategy for Cardiac Resynchronization Therapy?","N/A","Lian"
"37715742","2023","His-Purkinje Conduction System Pacing Optimized Trial of Cardiac Resynchronization Therapy vs Biventricular Pacing: HOT-CRT Clinical Trial.","His-Purkinje conduction system pacing (HPCSP) using His bundle pacing (HBP) or left bundle branch pacing (LBBP) has emerged as an alternative to biventricular pacing (BVP) in patients requiring cardiac resynchronization therapy (CRT). The aim of the study was to compare the feasibility and clinical efficacy of HOT-CRT (His-Purkinje conduction system pacing Optimized Trial of Cardiac Resynchronization Therapy) with BVP in patients with heart failure, reduced ejection fraction, and indication for CRT. This was a prospective, randomized, controlled trial of HOT-CRT and BVP in patients with LVEF <50% and indications for CRT. If HPCSP resulted in incomplete electrical resynchronization, a coronary sinus (CS) lead was added. The primary outcome was the change in left ventricular ejection fraction (LVEF) at 6 months. The primary safety endpoint was freedom from major complications. A total of 100 patients (female 31%, aged 70 ± 12 years, LVEF 31.5% ± 9.0%) were randomized. HOT-CRT was successful in 48 of 50 (96%) and BVP-CRT in 41 of 50 (82%) patients (P = 0.03). QRS duration significantly decreased from 164 ± 26 ms to 137 ± 20 ms with HOT-CRT and 166 ± 28 ms to 141 ± 19 ms with BVP. Fluoroscopy results (18.8 ± 12.4 min vs 23.8 ± 12.4 min, P = 0.05) and procedure duration (119 ± 42 min vs 114 ± 36 min, P = 0.5) were similar. The primary outcome of change in LVEF at 6 months was greater in HOT-CRT than in BVP (12.4% ± 7.3% vs 8.0% ± 10.1%, P = 0.02). The primary safety endpoint was similar (98% vs 94%, P = 0.62). Echocardiographic response of improvement in LVEF >5% occurred in 80% vs 61% (P = 0.06). Complications occurred in 3 (6%) in HOT-CRT vs 10 (20%) in BVP (P = 0.03). HPCSP-guided CRT resulted in greater change in LVEF compared with BVP. Randomized clinical trials with long-term follow-up are necessary. (His-Purkinje Conduction System Pacing Optimized Trial of Cardiac Resynchronization Therapy [HOT-CRT]; NCT04561778).","Vijayaraman"
"37611994","2023","Deep Learning for Premature Ventricular Contraction-Cardiomyopathy: Are We Digging Deep Enough?","N/A","Kowlgi"
"37589646","2023","Cardiac Conduction System Pacing: A Comprehensive Update.","The field of cardiac pacing has changed rapidly in the last several years. Since the initial description of His bundle pacing targeting the conduction system, recent advances in pacing the left bundle branch and its fascicles have evolved. The field and investigators' knowledge of conduction system pacing including relevant anatomy and physiology has advanced significantly. The aim of this review is to provide a comprehensive update on recent advances in conduction system pacing.","Vijayaraman"
