"PMID","Year","Title","Abstract","FirstAuthor"
"40439644","2025","Septal Intramyocardial Purkinje Network: A Potential New Mechanism Explaining Left Bundle Branch Area Pacing Physiology.","Despite the growing use of left bundle branch area pacing (LBBAP) to deliver conduction system pacing, the mechanism underlying the narrow QRS interval conferred by this pacing modality remains unclear. This study aimed to evaluate the mechanism that provides a most plausible explanation of LBBAP physiology. A cohort of 13 patients who had surface electrocardiographic (ECG) or intracardiac recording features not explainable by either selective or nonselective LBBAP were evaluated. Unique ECG patterns and intracardiac recordings over the right interventricular septum were analyzed, as well as septal Purkinje fiber staining patterns in human cardiac tissue, to assess whether such findings can be attributed to the capture of the recently discovered intramyocardial Purkinje network. The following unexpected ECG and intracardiac recording patterns were observed during LBBAP: 1) alternating incomplete right bundle branch block and left bundle branch block in an output-independent and output-dependent fashion; 2) variable, instead of all-or-none, recruitment of both left and right bundle systems; 3) correction of baseline right bundle branch block at low outputs; 4) paced QRS axis and duration closely matching the baseline narrow QRS interval in patients who underwent atrioventricular node ablation; and 5) intracardiac recordings demonstrating rapid, apparently nonphysiological activation of the right ventricular septum. Additionally, extensive Purkinje tissue was identified deep inside the septal myocardium in the human heart near the usual location of the LBBAP lead. These data suggest a potential physiological role of the intramyocardial Purkinje system. Direct capture of Purkinje fibers connected to both bundle branches to rapidly activate both ventricles could provide a unifying explanation for these counterintuitive findings.","Liu"
"40439643","2025","Simultaneous Right and Left Bundle Pacing: Rationale and Feasibility in Lieu of His Bundle Pacing.","N/A","Trivedi"
"40372330","2025","Clinical Response to Resynchronization Therapy: Conduction System Pacing vs Biventricular Pacing: The CONSYST-CRT Trial.","Randomized studies comparing conduction system pacing (CSP) with biventricular pacing (BiVP) are scarce and do not include clinical outcomes. The CONSYST-CRT (Conduction System Pacing vs Biventricular Resynchronization Therapy in Systolic Dysfunction and Wide QRS) trial aimed to test the noninferiority of CSP as compared with BiVP in patients with an indication for cardiac resynchronization therapy, with respect to a combined clinical endpoint at 1-year follow-up. A total of 134 patients with cardiac resynchronization therapy indication were randomized to BiVP or CSP and followed up for 12 months. Crossover was allowed when the primary allocation procedure failed. The atrioventricular interval was optimized to obtain fusion with intrinsic conduction. The primary combined endpoint was all-cause mortality, cardiac transplant, heart failure hospitalization, or left ventricular ejection fraction (LVEF) improvement <5 points at 12 months. Secondary endpoints were LVEF increase, LV end-systolic volume (LVESV) decrease, echocardiographic response (≥15% LVESV decrease), QRS shortening, septal flash correction, NYHA functional class improvement, and a combined endpoint of all-cause mortality, cardiac transplantation, and heart failure hospitalization. Sixty-seven patients were allocated to each group. Eighteen patients (26.9%) crossed from CSP to BiVP; 5 (7.5%) crossed over from BiVP to CSP. Noninferiority (NI) was observed for CSP compared with BiVP for the primary endpoint (23.9% vs 29.8%, respectively; mean difference -5.9; 95% CI: -21.1 to 9.2; P = 0.02) and for the combined endpoint of all-cause mortality, cardiac transplantation, and heart failure hospitalization (11.9% vs 17.9%; P < 0.01 NI); echocardiographic response (66.6% vs 59.7%; P = 0.03 NI); NYHA functional class (P < 0.001 NI); and QRS shortening (P < 0.01). LVEF, LVESV, and septal flash endpoint values were similar, but noninferiority was not met (14.1% ± 10% vs 14.4% ± 10%, -27.9% ± 27% vs -27.9% ± 28%, -2.2 ± 2.7 mm vs -2.7 ± 2.4 mm, respectively). CSP was noninferior to BiVP in achieving clinical and echocardiographic response, suggesting that CSP could be an alternative to BiVP. (Conduction System Pacing vs Biventricular Resynchronization Therapy in Systolic Dysfunction and Wide QRS [CONSYST-CRT]; NCT05187611).","Pujol-López"
"40338779","2025","Left Bundle Branch Pacing: Histology, the Key to Understand Different Responses.","N/A","Cabrera"
"40208157","2025","Partial Perforation: A Tolerated Reality of Left Bundle Branch Area Pacing?","N/A","Herweg"
"40117417","2025","Clinical Outcomes and Electrophysiological Characteristics of Partial Perforation After Left Bundle Branch Area Pacing.","Septal perforation, defined as partial or complete protrusion of a lead helix, is a potential complication of left bundle branch area pacing, theoretically increasing risks of pacing failure and thromboembolism. However, no studies have examined the long-term prognosis of patients with partial perforations (PPs). This study aimed to elucidate the incidence, outcomes, and electrophysiological characteristics of PP in clinical and experimental swine studies. Patients requiring pacing who underwent successful left bundle branch area pacing were retrospectively included. PP was identified using postoperative echocardiography. Clinical outcomes, including all-cause mortality, thromboembolism, and lead-related complications, were compared between the PP and non-PP groups. Waveforms from the nonfiltered unipolar electrogram (NF-EGM) recorded at the lead tip were evaluated to identify morphology specific to PP. Of the 95 patients, PP was confirmed in 25 (26.3%), occurring only in patients with left bundle branch capture, with an incidence rate of 41.7%. Event-free survival rates were comparable between the PP and non-PP groups at a median follow-up of 24 months (log rank, P = 0.298). No thromboembolisms or lead-related complications occurred in the PP group. The type-QS and type-R morphologies of NF-EGM reliably identified and excluded PP, respectively, as validated in swine heart experiments. This study found that PP is not associated with an increased risk of adverse clinical outcomes. Deep septal lead deployment utilizing the NF-EGM morphology would be useful in recognizing and avoiding PP intraoperatively.","Kato"
"40100197","2025","Real-World Artificial Intelligence-Based Electrocardiographic Analysis to Diagnose Hypertrophic Cardiomyopathy.","There is an emerging interest in artificial intelligence-enhanced 12-lead electrocardiogram (AI-ECG) in detection of hypertrophic cardiomyopathy (HCM). This study describes the initial real-world experience of using AI-ECG (Viz-HCM, developed using a convolutional neural network trained algorithm) in our center. All patients undergoing 12-lead electrocardiograms at Cleveland Clinic, Cleveland, Ohio, between February 19, 2024, and November 1, 2024, were prospectively analyzed for potential HCM using AI-ECG. The numbers of patients flagged for potential HCM were recorded. Presence of confirmed HCM, a new diagnosis of HCM following AI-ECG assessment (with a negative prior clinical evaluation), and alternative non-HCM diagnosis were recorded. Assessment of AI-ECG diagnostic performance was done using various HCM probability thresholds (≥0.95, ≥0.90, and ≥0.85). Of 103,492 electrocardiograms analyzed in 45,873 patients, AI-ECG flagged potential HCM in 1,265 (2.7%) unique patients. Of these, 511 (40.4%) had confirmed HCM, 63 (5%) had new HCM diagnosis, and 691 (54.6%) had an alternate diagnosis. HCM probability threshold of ≥0.85 provided the highest sensitivity (95%) for diagnosis of HCM with high specificity and accuracy (all >98%). The positive predictive value was the highest (66%) at the cutoff ≥0.95 but with a lower sensitivity at 50%. The AI-ECG algorithm performed similarly in both men and women, and was more sensitive in individuals <50 years but more specific in individuals ≥50 years. Prospective real-world application of the AI-ECG algorithm to detect HCM was associated with a high degree of accuracy, varying with the chosen probability threshold. It also enabled the identification of 5% of patients with no prior HCM diagnosis.","Desai"
"40100196","2025","Expert-Level Automated Diagnosis of the Pediatric ECG Using a Deep Neural Network.","Disparate access to expert pediatric cardiologist care and interpretation of electrocardiograms (ECGs) persists worldwide. Artificial intelligence-enhanced ECG (AI-ECG) has shown promise for automated diagnosis of ECGs in adults but has yet to be explored in the pediatric setting. This study sought to determine whether an AI-ECG model can accurately perform automated diagnosis of pediatric ECGs. This retrospective single-center cohort study included all patients with an ECG at Boston Children's Hospital read by an experienced pediatric cardiologist (≥5,000 reads) between 2000 and 2022. A convolutional neural network was trained (75% of patients) and internally tested (25% of patients) on ECGs to predict ECG diagnoses. The primary outcome was a composite of any ECG abnormality (ie, detecting normal vs abnormal ECG). Secondary outcomes include Wolff-Parkinson-White syndrome (WPW) and prolonged QTc. Model performance was assessed with area under the receiver-operating (AUROC) and precision recall (AUPRC) curves. The main cohort consisted of 201,620 patients (49% male; 11% with known congenital heart disease) and 583,134 ECGs (median age 11.7 years [Q1-Q3: 3.1-16.9 years]; 56% any ECG abnormality, 1.0% WPW, and 5.3% with prolonged QTc). The AI-ECG model outperformed the commercial software interpretations for detecting any abnormality (AUROC 0.94; AUPRC 0.96), WPW (AUROC 0.99; AUPRC 0.88), and prolonged QTc (AUROC 0.96; AUPRC 0.63). During readjudication of ECGs with AI-ECG/original cardiologist read discordance, blinded expert readers were more likely to agree with AI-ECG classification than the original reader to detect any abnormality (P = 0.001), WPW (P = 0.01), and prolonged QTc (P = 0.07). Our model provides expert-level automated diagnosis of the pediatric 12-lead ECG, which may improve access to care.","Mayourian"
"40099772","2025","Automated Diagnosis of Pediatric ECG Through AI-ECG: As Good (And Bad) as The Experts.","N/A","Nash"
"39945715","2025","Causal Machine Learning for Left Atrial Appendage Occlusion in Patients With Atrial Fibrillation.","Transcatheter left atrial appendage occlusion (LAAO) is an alternative to lifelong anticoagulation, but optimal patient selection remains challenging. This study sought to apply a novel causal machine learning framework to identify patients who would benefit from LAAO vs a direct oral anticoagulant (DOAC). We identified 744,190 adult patients with atrial fibrillation treated with either LAAO or DOAC between March 13, 2015, and December 31, 2019, using data from OptumLabs Data Warehouse. One-to-one propensity score matching was used to create a cohort where patients were similar in 107 baseline characteristics. A causal forest model was used to estimate the heterogeneous treatment effect for a composite outcome of ischemic stroke, systemic embolism, major bleeding, and all-cause mortality. In the matched cohort of 28,930 patients, the mean age was 76.8 ± 6.3 years; 5,818 patients (40%) were female, and the mean CHADS-VASc score was 5.8. LAAO was associated with no difference with the primary composite outcome in comparison to NOAC early on (average treatment effect of -0.68% [-1.4%, 0.06%] at 1 year), but a lower risk at the end of 2 years (average treatment effect of -2.9% [-3.7%, -2.0%]). At the end of 2 years, 30.1% of the overall cohort were classified as potentially benefiting from LAAO, 69.7% were classified as neutral, and 1.4% were potentially harmed by LAAO. Novel machine learning algorithms were developed to identify patients who are more likely to benefit from LAAO vs DOACs. This information can support clinical decision-making to determine which patients should be referred to subspecialists for further examination and discussion of LAAO.","Ngufor"
"39846924","2025","Automated Beat-to-Beat Measurement of R-Wave Peak Time for Left Bundle Branch Area Pacing.","N/A","Spadotto"
"39808087","2025","Artificial Intelligence-Enabled Electrocardiogram Predicts Sudden Cardiac Death in Repaired Tetralogy of Fallot.","N/A","Mayourian"
"39603761","2024","The Dark Side of the Moon: Ventricular Dysfunction After Left Bundle Branch Area Pacing.","N/A","Pillai"
"39570266","2024","Lead Integrity and Failure Evaluation in Left Bundle Branch Area Pacing: The LIFE-LBBAP Study.","Left bundle branch area pacing (LBBAP) has gained increased adoption globally with the use of both lumenless leads (LLLs) and stylet-driven leads (SDLs). As these leads have been developed for conventional endocardial pacing sites, concerns remain regarding the lead integrity with LBBAP. This study evaluates lead integrity of pacing leads used for LBBAP in a large, real-world cohort of patients with LBBAP. Patients with successful LBBAP from 17 international centers were enrolled in this observational study. Data on overall lead integrity, fracture rates, and locations of fractures were collected. The study enrolled 8,255 patients with LBBAP (age 73 ± 13 years, 42% female, 68% LLLs, and 32% SDLs). Overall lead survival rate was 99.7% with median follow-up of 16.4 (Q1-Q3: 6.4-28.8) months. Lead fracture occurred in 12 of 8,255 (0.15%) patients. Lead fracture rates of LLLs occurred in 2 of 5,609 (0.04%) vs 10 of 2,646 (0.4%) patients for SDLs, during a follow-up of 19.5 (Q1-Q3: 9.7-33) and 10.3 (Q1-Q3: 2.9-19.7) months, respectively (P < 0.001). SDL fractures occurred at 13.9 (Q1-Q3: 6.1-17.7) months after implant, whereas 2 LLL fractures occurred at 21 and 31.4 months. SDL and LLL conductor fractures were observed in 7 of 17 and 2 of 17 centers, respectively. Confirmed fractures of the SDL lead originated within the interelectrode lead segment, whereas LLL fractures occurred proximal to the ring. LBBAP lead performance of LLLs and SDLs is high at midterm follow-up. SDLs exhibit higher rates of fracture compared to LLLs. Hot spots for conductor fracture are the distal interelectrode segment in SDLs and the segment proximal to the ring electrode in LLLs.","De Pooter"
"39520430","2024","AI and Personal Digital Health Tools: Pioneering the Future of Precision Health Care.","N/A","Gay"
"39480392","2024","Visualization of Mechanisms for Myocardium-Originating Premature Ventricular Contractions With Narrow QRS Via His-Purkinje System.","N/A","Onishi"
"39477681","2024","Successful Implantation of Defibrillator Leads for Left Bundle Branch Pacing: Is Our Triumph Pyrrhic?","N/A","Pelling"
"39425726","2024","Persistent ST-Segment Elevation Before and After Left Bundle Branch Pacing.","N/A","Byers"
"39387744","2024","Serum Potassium Monitoring Using AI-Enabled Smartwatch Electrocardiograms.","Hyperkalemia, characterized by elevated serum potassium levels, heightens the risk of sudden cardiac death, particularly increasing risk for individuals with chronic kidney disease and end-stage renal disease (ESRD). Traditional laboratory test monitoring is resource-heavy, invasive, and unable to provide continuous tracking. Wearable technologies like smartwatches with electrocardiogram (ECG) capabilities are emerging as valuable tools for remote monitoring, potentially allowing for personalized monitoring with artificial intelligence (AI)-ECG interpretation. The purpose of this study was to develop an AI-ECG algorithm to predict serum potassium level in ESRD patients with smartwatch-generated ECG waveforms. A cohort of 152,508 patients with 293,557 ECGs paired serum potassium levels obtained within 1 hour at Cedars Sinai Medical Center was used to train an AI-ECG model (""Kardio-Net"") to predict serum potassium level. The model was further fine-tuned on 4,337 ECGs from 1,463 patients with ESRD using inputs from 12- and single-lead ECGs. Kardio-Net was evaluated in held-out test cohorts from Cedars Sinai Medical Center and Stanford Healthcare (SHC) as well as a prospective international cohort of 40 ESRD patients with smartwatch ECGs at Chang Gung Memorial Hospital. The Kardio-Net, when applied to 12-lead ECGs, identified severe hyperkalemia (>6.5 mEq/L) with an AUC of 0.852 (95% CI: 0.745-0.956) and a mean absolute error (MAE) of 0.527 mEq/L. In external validation at SHC, the model achieved an AUC of 0.849 (95% CI: 0.823-0.875) and an MAE of 0.599 mEq/L. For single-lead ECGs, Kardio-Net detected severe hyperkalemia with an AUC of 0.876 (95% CI: 0.765-0.987) in the primary cohort and had an MAE of 0.575 mEq/L. In the external SHC validation, the AUC was 0.807 (95% CI: 0.778-0.835) with an MAE of 0.740 mEq/L. Using prospectively obtained smartwatch data, the AUC was 0.831 (95% CI: 0.693-0.975), with an MAE of 0.580 mEq/L. We validate a deep learning model to predict serum potassium levels from both 12-lead ECGs and single-lead smartwatch data, demonstrating its utility for remote monitoring of hyperkalemia.","Chiu"
"39387739","2024","Insights Into Left Bundle Branch Area Pacing: Important Lessons Learned.","N/A","Ellenbogen"
"39387738","2024","Transseptal Transition Patterns During Left Bundle Branch Area Lead Implantation.","Continuous deep septal pacing and signal recording during implantation of left bundle branch pacing (LBBP) lead enables to monitor beat-to-beat changes of electrocardiogram (ECG) and myocardial current of injury (COI) as the lead crosses the septum. This study aimed to characterize patterns of continuous QRS, ST-T, and COI change for monitoring of the lead depth and instantaneous determination of the obtained capture type (LBBP vs left ventricular septal pacing [LVSP]). The ECG and COI during lead implantation were scrutinized for sudden changes of VR-wave peak time, V initial and terminal R-wave amplitude, V-VR-wave amplitude, repolarization pattern and S-wave amplitude in I, V-V, and COI drop. The sudden and gradual transition patterns were diagnosed depending on the presence or absence of the above beat-to-beat ECG phenomena, respectively. A total of 212 pacemaker recipients were analyzed; LBBP and LVSP were obtained in 77.4% and 22.6%, respectively. There were 4.7 ± 2.1 and 0.2 ± 0.6 beat-to-beat phenomena in LBBP and LVSP patients, respectively. The sudden transition pattern, recognized in 80.7%, had sensitivity and specificity for LBBP diagnosis of 98.8% and 81.2%, respectively. A sudden drop of COI (29.4 ± 8.5 mV to 12.8 ± 4.9 mV) was observed in 53.9% patients (LBBP was simultaneously obtained in 92.7%). Capture of left bundle branch during lead penetration is a beat-to-beat phenomenon. Two transseptal transition patterns were identified: 1) sudden, which is typical for obtaining LBBP; and 2) gradual, which is typical for obtaining LVSP. A sudden COI drop, a very observable phenomenon, also identified reaching the left subendocardial area.","Jastrzębski"
"39387737","2024","Overcoming Lead Penetration Failure in Left Bundle Branch Area Pacing.","Left bundle branch area pacing is an innovative technique employed to maintain left ventricular synchrony. However, the operator can face challenges in penetrating the lead into the septum during screwing. Two pitfalls-helix-only penetration and shallow penetration-hinder lead penetration. The research, conducted in 2 phases on patients and swine hearts, tested 2 techniques to overcome these issues. The results highlight the impact of endocardial involvement and suggest that the optimal technique involves intentionally creating an endocardial breach rather than simply unscrewing and rescrewing. This solution could facilitate the procedure by minimizing the number of attempts to reach the pacing site and thus reducing the risk of complications.","Menet"
"39340506","2024","New-Onset Left Ventricular Dysfunction After Left Bundle Branch Pacing.","Left bundle branch pacing (LBBP) provides stable pacing parameters and has been suggested as an alternative for right ventricular pacing and cardiac resynchronization therapy. The aim of the study was to assess the incidence and etiology of new-onset left ventricular dysfunction (NOLVD) following LBBP in patients with baseline normal left ventricular (LV) function and cardiomyopathy patients with normalized LV function. Patients undergoing successful LBBP for symptomatic bradyarrhythmia or as an alternative to cardiac resynchronization therapy were included. Normalization of LV function was defined as improvement in LV ejection fraction to ≥50%. Patients with baseline normal LV function and those with recovered LV function after LBBP constituted the study group. Loss of conduction system capture (LOCSC) was defined as complete or partial loss of right bundle branch delay pattern along with inability to demonstrate capture transition during threshold assessment. A total of 426 patients were included; 59% (n = 250) had baseline normal LV function (group I) and 41% (n = 176) had recovered LV function after LBBP (group II). Mean follow-up duration of 28.3 ± 16.7 months. NOLVD was noted in 3.75% (n = 16; group I, n = 5, and group II, n = 11) of patients. The etiologies for NOLVD were LOCSC in 62.5% (n = 10), suboptimal atrioventricular (AV) delay in 18.7% (n = 3), atrial fibrillation in 6.3% (n = 1), and idiopathic in 12.5% (n = 2). LOCSC occurred at a mean interval of 9.2 ± 6.4 months after the initial implantation. Reinterventions (n = 6) including lead repositioning, AV delay optimization, and AV junction ablation resulted in renormalization of LV function in all 6 patients. Periodic assessment in device clinic is required because NOLVD from reversible causes can occur during follow-up in patients after LBBP.","Ponnusamy"
"39297841","2024","Electrocardiogram-Based Deep Learning to Predict Mortality in Repaired Tetralogy of Fallot.","Artificial intelligence-enhanced electrocardiogram (AI-ECG) analysis shows promise to predict mortality in adults with acquired cardiovascular diseases. However, its application to the growing repaired tetralogy of Fallot (rTOF) population remains unexplored. This study aimed to develop and externally validate an AI-ECG model to predict 5-year mortality in rTOF. A convolutional neural network was trained on electrocardiograms (ECGs) obtained at Boston Children's Hospital and tested on Boston (internal testing) and Toronto (external validation) INDICATOR (International Multicenter TOF Registry) cohorts to predict 5-year mortality. Model performance was evaluated on single ECGs per patient using area under the receiver operating (AUROC) and precision recall (AUPRC) curves. The internal testing and external validation cohorts comprised of 1,054 patients (13,077 ECGs at median age 17.8 [Q1-Q3: 7.9-30.5] years; 54% male; 6.1% mortality) and 335 patients (5,014 ECGs at median age 38.3 [Q1-Q3: 29.1-48.7] years; 57% male; 8.4% mortality), respectively. Model performance was similar during internal testing (AUROC 0.83, AUPRC 0.18) and external validation (AUROC 0.81, AUPRC 0.21). AI-ECG performed similarly to the biventricular global function index (an imaging biomarker) and outperformed QRS duration. AI-ECG 5-year mortality prediction, but not QRS duration, was a significant independent predictor when added into a Cox regression model with biventricular global function index to predict shorter time-to-death on internal and external cohorts. Saliency mapping identified QRS fragmentation, wide and low amplitude QRS complexes, and flattened T waves as high-risk features. This externally validated AI-ECG model may complement imaging biomarkers to improve risk stratification in patients with rTOF.","Mayourian"
"39243257","2024","Standard Defibrillator Leads for Left Bundle Branch Area Pacing: First-in-Man Experience and Short-Term Follow-Up.","The authors report for the first time to their knowledge, implantation of a standard implantable cardioverter-defibrillator lead for permanent delivery of left bundle branch area pacing. Implantation was successful and safe in 11 of 12 patients, with adequate defibrillation testing, good electrical and electrocardiographic parameters, and uneventful device-related short-term follow-up.","Imnadze"
